{
  "schema_version": 1,
  "current": "2026-09-23",
  "updated_at": "2026-09-23T09:21:22+08:00",
  "editions": [
    {
      "date": "2026-09-23",
      "path": "data/editions/2026-09-23.json",
      "story_count": 11,
      "is_demo": false
    },
    {
      "date": "2026-09-22",
      "path": "data/editions/2026-09-22.json",
      "story_count": 13,
      "is_demo": false
    }
  ]
}
